{
	"info": {
		"_postman_id": "bfab2101-4a00-4381-9c2d-594b6b768fb6",
		"name": "ClaimIntimation",
		"schema": "https://schema.getpostman.com/json/collection/v2.1.0/collection.json",
		"_exporter_id": "36989078"
	},
	"item": [
		{
			"name": "OemLink",
			"protocolProfileBehavior": {
				"disabledSystemHeaders": {
					"accept-encoding": true,
					"accept": true
				}
			},
			"request": {
				"method": "POST",
				"header": [
					{
						"key": "X-IBM-Client-Id",
						"value": "458b817795bad480c5c59e6c424fd285",
						"type": "text"
					},
					{
						"key": "X-IBM-Client-Secret",
						"value": "51d9ae9279382a4fa6f1becd4c41ca84",
						"type": "text"
					},
					{
						"key": "KEY",
						"value": "05y/Zh9tsXeFAkRCz93poem27hMLV2iX",
						"type": "text"
					},
					{
						"key": "IV",
						"value": "VTXb7e2p1iQ=",
						"type": "text"
					},
					{
						"key": "Authorization",
						"value": "eyJhbGciOiJIUzI1NiJ9.eyJpc3MiOiI0NThiODE3Nzk1YmFkNDgwYzVjNTllNmM0MjRmZDI4NSIsImF1ZCI6IjUxZDlhZTkyNzkzODJhNGZhNmYxYmVjZDRjNDFjYTg0IiwiZXhwIjoxNzM0NjA3NDY3LCJpYXQiOjE3MzQ2MDcyODd9.lwRM8M1b6agxxYZ34TLGR7rQ7DrQHZNV7tr79JXmHHY",
						"type": "text"
					}
				],
				"body": {
					"mode": "raw",
					"raw": "{\r\n    \"ciphertext\": \"FVQOLcsAEx2GcNP8i7d8uGEziyZAnCKduEv0pHV6FBCrvjU4YG8BeIUjFf8ta+7cFrCUPP/c7gu5x1eaK/hvhGraU1Z38bPqhyCR3gIajeUCoc1jUr6J1LZcSujaOQ4EaCJQOJWzI0SOWlzp9SHXwEZbSoTfQP12dFZ4xNEFHL+wq5Gm518DcpVJZ1+Svlc8hhbgCLgvSfukH13L9yM9O9B0GP4p8a3NXpw1uSKkY4eypR6cdfRJ0FDrPankyp3zMuhBL1ibib364KEx4tXEfrCXwD64W33Bm3gvBPMuefyS89veM2iLSd78xbmuB1yRb4UAyIy89jlbgbCZytQVF1G1PDc3kFkSm6mzFob1u/ykCrhbbdP4edpFIOSUecwNQmpDpd8/vH4YKiQ/T1MvBSd/ll7zvroqBxhgmqdzz1e5aXZGlAMfRxvIZK/YUWHECAXfCYly6Xj1ETOISwDfypehI4zxdBOMnWq8cbkVIzkBh7qUIvKeQKbFVz0hQETR39qH1SuGgm6tSOvIc2/JWB8Acb+Eu/+Fj7sa4LIS/0Nk3jJG3DQuPNMzaIFUM6o8I+MM5T/3GRPkMroqqQgxkG5Xl7DlkodOvsxxUR0WIOJMbwUY9gFSwM/bs8aAkFf38uig2PWsUmypvQjNcy0TLjp/t3PDq8L0e8AASgzdihzfgkKza8YBkVoSKNypQ6zDiixzipZ5oMyDIA/8ec50cod4v9vSPTsM2iGPfCRDvw9NKQKvrm2Nzn2+qfGnIzGOfwkktd6oEgNRAQp46VIbu5ZHXo40GPIQwa1+cm6s0Iv/GRAunfTIEbTfEdBqinwjw5zu2OjmtICcXVJ2xF5diYpEu8IRWLAv212HY3WPB+SfWWrL12feVkXwS/d27qQs3Q2zAd5pwKNH1Fy6MQ==\"\r\n}",
					"options": {
						"raw": {
							"language": "json"
						}
					}
				},
				"url": {
					"raw": "https://devapi.sbigeneral.in/v1/Motoveys/API1/ICIntimation",
					"protocol": "https",
					"host": [
						"devapi",
						"sbigeneral",
						"in"
					],
					"path": [
						"v1",
						"Motoveys",
						"API1",
						"ICIntimation"
					]
				}
			},
			"response": []
		},
		{
			"name": "getToken",
			"request": {
				"method": "GET",
				"header": [
					{
						"key": "X-IBM-Client-Id",
						"value": "458b817795bad480c5c59e6c424fd285",
						"type": "text"
					},
					{
						"key": "X-IBM-Client-Secret",
						"value": "51d9ae9279382a4fa6f1becd4c41ca84",
						"type": "text"
					}
				],
				"url": {
					"raw": "https://devapi.sbigeneral.in/v1/tokens",
					"protocol": "https",
					"host": [
						"devapi",
						"sbigeneral",
						"in"
					],
					"path": [
						"v1",
						"tokens"
					]
				}
			},
			"response": []
		},
		{
			"name": "https://devapi.sbigeneral.in/customers/v1/chatbot/claimintimation",
			"request": {
				"method": "POST",
				"header": [
					{
						"key": "X-IBM-Client-Id",
						"value": "458b817795bad480c5c59e6c424fd285"
					},
					{
						"key": "X-IBM-Client-Secret",
						"value": "51d9ae9279382a4fa6f1becd4c41ca84"
					},
					{
						"key": "Authorization",
						"value": "eyJhbGciOiJIUzI1NiJ9.eyJpc3MiOiI0NThiODE3Nzk1YmFkNDgwYzVjNTllNmM0MjRmZDI4NSIsImF1ZCI6IjUxZDlhZTkyNzkzODJhNGZhNmYxYmVjZDRjNDFjYTg0IiwiZXhwIjoxNzM3NDUwOTY1LCJpYXQiOjE3Mzc0NTA3ODV9.teM6znDESaNUEwxE_gIAkQRWMphk50GPcXHw90F-7R4"
					},
					{
						"key": "Content-Type",
						"value": "application/json"
					}
				],
				"body": {
					"mode": "raw",
					"raw": "{\r\n    \"RequestHeader\": {\r\n        \"requestID\": \"123456\",\r\n        \"action\": \"claimIntimation\",\r\n        \"channel\": \"SBIG\",\r\n        \"transactionTimestamp\": \"14-Jan-2025-16:41:23\"\r\n    },\r\n    \"RequestBody\": {\r\n        \"Claims\": {\r\n            \"ServiceType\": \"Intimation\",\r\n            \"TieUpClaimId\": null,\r\n            \"UserId\": \"20063258\",\r\n            \"InsuranceComapany\": \"UATAICI\",\r\n            \"Claim\": {\r\n                \"PolicyNumber\": \"POPM2W0010004345\",\r\n                \"RegistrationNumber\": \"MH 04 HQ 8035\",\r\n                \"ContactName\": \"LEENA DILIP ACHAREKAR\",\r\n                \"ClaimServicingbranch\": \"Mumbai\",\r\n                \"ContactNumber\": \"9000000000\",\r\n                \"emailID\": \"GAUTHAM@GMAIL.COM\",\r\n                \"AccidentDateandtime\": \"14/01/2025 04:39:00\",\r\n                \"AccidentCity\": \"Kozhikode\",\r\n                \"VehicleInspectionAddress\": \",Kozhikode,Kerala\",\r\n                \"CityName\": \"Kozhikode\",\r\n                \"StateName\": \"Kerala\",\r\n                \"InspectionSpotLocation\": \"\",\r\n                \"Garage\": \"Not\",\r\n                \"DriverName\": \"\",\r\n                \"isInsured\": \"Y\",\r\n                \"ClaimIntimatedBy\": \"Insured\",\r\n                \"CauseOfLoss\": \"Hit by another vehicle whilst parked\",\r\n                \"Others\": \"Testing \",\r\n                \"EstimatedClaimAmount\": \"50000\"\r\n            }\r\n        }\r\n    }\r\n}",
					"options": {
						"raw": {
							"language": "json"
						}
					}
				},
				"url": {
					"raw": "https://devapi.sbigeneral.in/customers/v1/chatbot/claimintimation",
					"protocol": "https",
					"host": [
						"devapi",
						"sbigeneral",
						"in"
					],
					"path": [
						"customers",
						"v1",
						"chatbot",
						"claimintimation"
					]
				},
				"description": "Generated from cURL: curl --location --request POST 'https://devapi.sbigeneral.in/customers/v1/chatbot/claimintimation' \\\r\n--header 'X-IBM-Client-Id: 458b817795bad480c5c59e6c424fd285' \\\r\n--header 'X-IBM-Client-Secret: 51d9ae9279382a4fa6f1becd4c41ca84' \\\r\n--header 'Authorization: eyJhbGciOiJIUzI1NiJ9.eyJpc3MiOiI0NThiODE3Nzk1YmFkNDgwYzVjNTllNmM0MjRmZDI4NSIsImF1ZCI6IjUxZDlhZTkyNzkzODJhNGZhNmYxYmVjZDRjNDFjYTg0IiwiZXhwIjoxNzM2OTQwNjY3LCJpYXQiOjE3MzY5NDA0ODd9.l4FPXb1wZB1NmOn2L0kvbibLimFeEJVU3aD2etbD2Cc' \\\r\n--header 'Content-Type: application/json' \\\r\n--data-raw '{\r\n    \"RequestHeader\": {\r\n        \"requestID\": \"123456\",\r\n        \"action\": \"claimIntimation\",\r\n        \"channel\": \"SBIG\",\r\n        \"transactionTimestamp\": \"14-Jan-2025-16:41:23\"\r\n    },\r\n    \"RequestBody\": {\r\n        \"Claims\": {\r\n            \"ServiceType\": \"Intimation\",\r\n            \"TieUpClaimId\": 7368530837,\r\n            \"UserId\": \"20063258\",\r\n            \"InsuranceComapany\": \"UATAICI\",\r\n            \"Claim\": {\r\n                \"PolicyNumber\": \"POPM2W00100043459\",\r\n                \"RegistrationNumber\": \"MH 04 HQ 8035\",\r\n                \"ContactName\": \"LEENA DILIP ACHAREKAR\",\r\n                \"ClaimServicingbranch\": \"Mumbai\",\r\n                \"ContactNumber\": \"9000000000\",\r\n                \"emailID\": \"GAUTHAM@GMAIL.COM\",\r\n                \"AccidentDateandtime\": \"14/01/2025 04:39\",\r\n                \"AccidentCity\": \"Kozhikode\",\r\n                \"VehicleInspectionAddress\": \",Kozhikode,Kerala\",\r\n                \"CityName\": \"Kozhikode\",\r\n                \"StateName\": \"Kerala\",\r\n                \"InspectionSpotLocation\": \"\",\r\n                \"Garage\": \"Not\",\r\n                \"DriverName\": \"\",\r\n                \"isInsured\": \"Y\",\r\n                \"ClaimIntimatedBy\": \"Insured\",\r\n                \"CauseOfLoss\": \"Hit by another vehicle whilst parked\",\r\n                \"Others\": \"other\",\r\n                \"EstimatedClaimAmount\": \"0\"\r\n            }\r\n        }\r\n    }\r\n}'\r\n"
			},
			"response": []
		},
		{
			"name": "\thttp://localhost:7002/Intimation/getIntimationPolicyDetails",
			"request": {
				"auth": {
					"type": "noauth"
				},
				"method": "POST",
				"header": [],
				"body": {
					"mode": "raw",
					"raw": "0000000000381364",
					"options": {
						"raw": {
							"language": "text"
						}
					}
				},
				"url": {
					"raw": "http://localhost:7002/Intimation/getIntimationPolicyDetails",
					"protocol": "http",
					"host": [
						"localhost"
					],
					"port": "7002",
					"path": [
						"Intimation",
						"getIntimationPolicyDetails"
					]
				}
			},
			"response": []
		},
		{
			"name": "Intimation/intimateMotorClaim",
			"protocolProfileBehavior": {
				"disabledSystemHeaders": {}
			},
			"request": {
				"auth": {
					"type": "noauth"
				},
				"method": "POST",
				"header": [],
				"body": {
					"mode": "raw",
					"raw": "{\r\n    \"RequestHeader\": {\r\n        \"requestID\": \"123456\",\r\n        \"action\": \"claimIntimation\",\r\n        \"channel\": \"SBIG\",\r\n        \"transactionTimestamp\": \"20-Jan-2025-16:41:23\"\r\n    },\r\n    \"RequestBody\": {\r\n        \"Claims\": {\r\n            \"ServiceType\": \"Intimation\",\r\n            \"TieUpClaimId\": null,\r\n            \"InsuranceCompany\": \"UATAICI\",\r\n            \"Claim\": {\r\n                \"PolicyNumber\": \"0000000000381007\",\r\n                \"RegistrationNumber\": \"MH 05 AX 3353\",\r\n                \"ContactName\": \"Sushant Reddy\",\r\n                \"ClaimServicingbranch\": \"Mumbai\",\r\n                \"ContactNumber\": \"+91-9145153399\",\r\n                \"emailID\": \"omireddy.aqm@gmail.com\",\r\n                \"AccidentDateandtime\": \"20/01/2025 16:54:00\",\r\n                \"AccidentCity\": \"Thane\",\r\n                \"VehicleInspectionAddress\": \"Jha Automobiles\",\r\n                \"CityName\": \"Thane\",\r\n                \"StateName\": \"Maharashtra\",\r\n                \"InspectionSpotLocation\": \"Thane\",\r\n                \"Garage\": \"Jha Automobiles\",\r\n                \"DriverName\": \"JJ\",\r\n                \"isInsured\": \"Y\",\r\n                \"ClaimIntimatedBy\": \"Insured\",\r\n                \"CauseOfLoss\": \"In parking\",\r\n                \"Others\": \"Testing\",\r\n                \"EstimatedClaimAmount\": \"70000\"\r\n            }\r\n        }\r\n    }\r\n}",
					"options": {
						"raw": {
							"language": "json"
						}
					}
				},
				"url": {
					"raw": "https://ansappsuat.sbigen.in/Intimation/intimateMotorClaim",
					"protocol": "https",
					"host": [
						"ansappsuat",
						"sbigen",
						"in"
					],
					"path": [
						"Intimation",
						"intimateMotorClaim"
					]
				}
			},
			"response": []
		},
		{
			"name": "getIntimationPolicyDetails",
			"request": {
				"auth": {
					"type": "noauth"
				},
				"method": "POST",
				"header": [],
				"body": {
					"mode": "raw",
					"raw": "0000000000381007",
					"options": {
						"raw": {
							"language": "text"
						}
					}
				},
				"url": {
					"raw": "https://ansappsuat.sbigen.in/Intimation/getIntimationPolicyDetails",
					"protocol": "https",
					"host": [
						"ansappsuat",
						"sbigen",
						"in"
					],
					"path": [
						"Intimation",
						"getIntimationPolicyDetails"
					]
				}
			},
			"response": []
		},
		{
			"name": "New getIntimationPolicyDetails",
			"request": {
				"auth": {
					"type": "noauth"
				},
				"method": "POST",
				"header": [],
				"body": {
					"mode": "raw",
					"raw": "0000000000381196",
					"options": {
						"raw": {
							"language": "text"
						}
					}
				},
				"url": {
					"raw": "http://localhost:7002/Intimation/getIntimationPolicyDetails",
					"protocol": "http",
					"host": [
						"localhost"
					],
					"port": "7002",
					"path": [
						"Intimation",
						"getIntimationPolicyDetails"
					]
				}
			},
			"response": []
		}
	]
}